{
  "schema_version": "0.1",
  "kind": "SESSION_BRIEF_PLAN",
  "status": "DRAFT_NOT_AUTHORIZED",
  "approval": "PENDING",
  "baseline_commit": "083f21c4b12a60c8556138d26d0aee516eb24d2b",
  "package_count": 36,
  "brief_count": 144,
  "session_order": [
    "S1",
    "S2",
    "S3",
    "S4"
  ],
  "briefs": [
    {
      "id": "BRIEF-WP-001-S1",
      "package": "WP-001",
      "stage": "S1",
      "status": "DRAFT_NOT_AUTHORIZED",
      "path": "governance/session-briefs/WP-001/S1.md",
      "sha256": "eaf84b61a397e2588ad4bc1724a3069c60c00efea0db45df24689f6a5cf1e7a6",
      "predecessor": "",
      "successor": "WP-001-S2",
      "requirements": [
        "REQ-GOV-001",
        "REQ-GOV-002",
        "REQ-GOV-003",
        "REQ-LIC-001"
      ],
      "contract_sha256": "b2ebafecb7211c165214d8b63f23649993c805d67ab5854b281bab3e2937c978",
      "declaration": "governance/work-packages/WP-001.md"
    },
    {
      "id": "BRIEF-WP-001-S2",
      "package": "WP-001",
      "stage": "S2",
      "status": "DRAFT_NOT_AUTHORIZED",
      "path": "governance/session-briefs/WP-001/S2.md",
      "sha256": "f727a014f1fb2af9f7d29e243f1b331fad7f3ee0fb2403326d7204fecd290f78",
      "predecessor": "WP-001-S1",
      "successor": "WP-001-S3",
      "requirements": [
        "REQ-GOV-001",
        "REQ-GOV-002",
        "REQ-GOV-003",
        "REQ-LIC-001"
      ],
      "contract_sha256": "b2ebafecb7211c165214d8b63f23649993c805d67ab5854b281bab3e2937c978",
      "declaration": "governance/work-packages/WP-001.md"
    },
    {
      "id": "BRIEF-WP-001-S3",
      "package": "WP-001",
      "stage": "S3",
      "status": "DRAFT_NOT_AUTHORIZED",
      "path": "governance/session-briefs/WP-001/S3.md",
      "sha256": "4ed610b22827ed24b5da0b78780761ccaf63da90f2311448792b13d559d51a8f",
      "predecessor": "WP-001-S2",
      "successor": "WP-001-S4",
      "requirements": [
        "REQ-GOV-001",
        "REQ-GOV-002",
        "REQ-GOV-003",
        "REQ-LIC-001"
      ],
      "contract_sha256": "b2ebafecb7211c165214d8b63f23649993c805d67ab5854b281bab3e2937c978",
      "declaration": "governance/work-packages/WP-001.md"
    },
    {
      "id": "BRIEF-WP-001-S4",
      "package": "WP-001",
      "stage": "S4",
      "status": "DRAFT_NOT_AUTHORIZED",
      "path": "governance/session-briefs/WP-001/S4.md",
      "sha256": "a28aa8f30afa6b19be0bb3073a48dd766fd6f981375330a43505e423925f6818",
      "predecessor": "WP-001-S3",
      "successor": "WP-002-S1",
      "requirements": [
        "REQ-GOV-001",
        "REQ-GOV-002",
        "REQ-GOV-003",
        "REQ-LIC-001"
      ],
      "contract_sha256": "b2ebafecb7211c165214d8b63f23649993c805d67ab5854b281bab3e2937c978",
      "declaration": "governance/work-packages/WP-001.md"
    },
    {
      "id": "BRIEF-WP-002-S1",
      "package": "WP-002",
      "stage": "S1",
      "status": "DRAFT_NOT_AUTHORIZED",
      "path": "governance/session-briefs/WP-002/S1.md",
      "sha256": "b52458e5852d5f16c023d9ae3f69e11e50cb20b54edaf1505fb33ee30bada5bb",
      "predecessor": "WP-001-S4",
      "successor": "WP-002-S2",
      "requirements": [
        "REQ-GOV-001"
      ],
      "contract_sha256": "ee4b77db1b7eedbe119c073ff3371ca44c4aa63d6677d41b96248710f7efe4d6",
      "declaration": "governance/work-packages/WP-002.md"
    },
    {
      "id": "BRIEF-WP-002-S2",
      "package": "WP-002",
      "stage": "S2",
      "status": "DRAFT_NOT_AUTHORIZED",
      "path": "governance/session-briefs/WP-002/S2.md",
      "sha256": "61ecb8e4742ad3e4cc93f0fc635d88f66a8849e75d0945935986b7beb1281b3f",
      "predecessor": "WP-002-S1",
      "successor": "WP-002-S3",
      "requirements": [
        "REQ-GOV-001"
      ],
      "contract_sha256": "ee4b77db1b7eedbe119c073ff3371ca44c4aa63d6677d41b96248710f7efe4d6",
      "declaration": "governance/work-packages/WP-002.md"
    },
    {
      "id": "BRIEF-WP-002-S3",
      "package": "WP-002",
      "stage": "S3",
      "status": "DRAFT_NOT_AUTHORIZED",
      "path": "governance/session-briefs/WP-002/S3.md",
      "sha256": "eb6041c480468fc7ede9fc5e58a24ca0cd29ecfb59c52b2bb9bd5dfc81c119b4",
      "predecessor": "WP-002-S2",
      "successor": "WP-002-S4",
      "requirements": [
        "REQ-GOV-001"
      ],
      "contract_sha256": "ee4b77db1b7eedbe119c073ff3371ca44c4aa63d6677d41b96248710f7efe4d6",
      "declaration": "governance/work-packages/WP-002.md"
    },
    {
      "id": "BRIEF-WP-002-S4",
      "package": "WP-002",
      "stage": "S4",
      "status": "DRAFT_NOT_AUTHORIZED",
      "path": "governance/session-briefs/WP-002/S4.md",
      "sha256": "139365b91eff1843e6113b230132ef4e3cd4a5ce2500e4852c98978a424fdfd8",
      "predecessor": "WP-002-S3",
      "successor": "WP-003-S1",
      "requirements": [
        "REQ-GOV-001"
      ],
      "contract_sha256": "ee4b77db1b7eedbe119c073ff3371ca44c4aa63d6677d41b96248710f7efe4d6",
      "declaration": "governance/work-packages/WP-002.md"
    },
    {
      "id": "BRIEF-WP-003-S1",
      "package": "WP-003",
      "stage": "S1",
      "status": "DRAFT_NOT_AUTHORIZED",
      "path": "governance/session-briefs/WP-003/S1.md",
      "sha256": "791d12e2d30f021706e582213d5f8c2abef7f6c2c2e2c105051f8d87a8508047",
      "predecessor": "WP-002-S4",
      "successor": "WP-003-S2",
      "requirements": [
        "REQ-PRIV-001"
      ],
      "contract_sha256": "7b2e5cb56586da789caf459ae366f5fc2fd1f88392ec77623ebdb330b4c6ed0b",
      "declaration": "governance/work-packages/WP-003.md"
    },
    {
      "id": "BRIEF-WP-003-S2",
      "package": "WP-003",
      "stage": "S2",
      "status": "DRAFT_NOT_AUTHORIZED",
      "path": "governance/session-briefs/WP-003/S2.md",
      "sha256": "8b9db2fd87f3f6bc73055405f57c73edbba93a340c0ff2d1066cf3a2addde342",
      "predecessor": "WP-003-S1",
      "successor": "WP-003-S3",
      "requirements": [
        "REQ-PRIV-001"
      ],
      "contract_sha256": "7b2e5cb56586da789caf459ae366f5fc2fd1f88392ec77623ebdb330b4c6ed0b",
      "declaration": "governance/work-packages/WP-003.md"
    },
    {
      "id": "BRIEF-WP-003-S3",
      "package": "WP-003",
      "stage": "S3",
      "status": "DRAFT_NOT_AUTHORIZED",
      "path": "governance/session-briefs/WP-003/S3.md",
      "sha256": "443a90d2339f6ed6e219f87081d89676487c008de3c8b864c8b3bbeb778cd959",
      "predecessor": "WP-003-S2",
      "successor": "WP-003-S4",
      "requirements": [
        "REQ-PRIV-001"
      ],
      "contract_sha256": "7b2e5cb56586da789caf459ae366f5fc2fd1f88392ec77623ebdb330b4c6ed0b",
      "declaration": "governance/work-packages/WP-003.md"
    },
    {
      "id": "BRIEF-WP-003-S4",
      "package": "WP-003",
      "stage": "S4",
      "status": "DRAFT_NOT_AUTHORIZED",
      "path": "governance/session-briefs/WP-003/S4.md",
      "sha256": "c2f6061b1105fa6bce6f5ea90412cc4690a6740bb1852324c8256d11e9a58b9d",
      "predecessor": "WP-003-S3",
      "successor": "WP-004-S1",
      "requirements": [
        "REQ-PRIV-001"
      ],
      "contract_sha256": "7b2e5cb56586da789caf459ae366f5fc2fd1f88392ec77623ebdb330b4c6ed0b",
      "declaration": "governance/work-packages/WP-003.md"
    },
    {
      "id": "BRIEF-WP-004-S1",
      "package": "WP-004",
      "stage": "S1",
      "status": "DRAFT_NOT_AUTHORIZED",
      "path": "governance/session-briefs/WP-004/S1.md",
      "sha256": "e4e09a0da4d7eff2b087d636b1b8d95d3eeb8ccb0c70497c8fd0aeab90b8cf20",
      "predecessor": "WP-003-S4",
      "successor": "WP-004-S2",
      "requirements": [
        "REQ-LOCAL-001",
        "REQ-EVID-003",
        "REQ-ENV-001"
      ],
      "contract_sha256": "f95578a941917e93a2cbacbe53a55c7a653c6dd34dbd2d5b1af43850aa3ebd48",
      "declaration": "governance/work-packages/WP-004.md"
    },
    {
      "id": "BRIEF-WP-004-S2",
      "package": "WP-004",
      "stage": "S2",
      "status": "DRAFT_NOT_AUTHORIZED",
      "path": "governance/session-briefs/WP-004/S2.md",
      "sha256": "91db57500cbe24d3fcd7242e91b7ebf241b87a257c86e30567e7d64a86e764c5",
      "predecessor": "WP-004-S1",
      "successor": "WP-004-S3",
      "requirements": [
        "REQ-LOCAL-001",
        "REQ-EVID-003",
        "REQ-ENV-001"
      ],
      "contract_sha256": "f95578a941917e93a2cbacbe53a55c7a653c6dd34dbd2d5b1af43850aa3ebd48",
      "declaration": "governance/work-packages/WP-004.md"
    },
    {
      "id": "BRIEF-WP-004-S3",
      "package": "WP-004",
      "stage": "S3",
      "status": "DRAFT_NOT_AUTHORIZED",
      "path": "governance/session-briefs/WP-004/S3.md",
      "sha256": "1c0b6aca7b2642bebea07c5e3c9348aaf6def304681543d7ca96023b415a589c",
      "predecessor": "WP-004-S2",
      "successor": "WP-004-S4",
      "requirements": [
        "REQ-LOCAL-001",
        "REQ-EVID-003",
        "REQ-ENV-001"
      ],
      "contract_sha256": "f95578a941917e93a2cbacbe53a55c7a653c6dd34dbd2d5b1af43850aa3ebd48",
      "declaration": "governance/work-packages/WP-004.md"
    },
    {
      "id": "BRIEF-WP-004-S4",
      "package": "WP-004",
      "stage": "S4",
      "status": "DRAFT_NOT_AUTHORIZED",
      "path": "governance/session-briefs/WP-004/S4.md",
      "sha256": "b2191e7fdc718f53b23d9e57f72c1e4fb03227b45a0db17f5a94d591f419d3c2",
      "predecessor": "WP-004-S3",
      "successor": "WP-005-S1",
      "requirements": [
        "REQ-LOCAL-001",
        "REQ-EVID-003",
        "REQ-ENV-001"
      ],
      "contract_sha256": "f95578a941917e93a2cbacbe53a55c7a653c6dd34dbd2d5b1af43850aa3ebd48",
      "declaration": "governance/work-packages/WP-004.md"
    },
    {
      "id": "BRIEF-WP-005-S1",
      "package": "WP-005",
      "stage": "S1",
      "status": "DRAFT_NOT_AUTHORIZED",
      "path": "governance/session-briefs/WP-005/S1.md",
      "sha256": "403d95f23c7381af06ce8e99d68d85d36dda8e43cc7faf61413494ecefd389a3",
      "predecessor": "WP-004-S4",
      "successor": "WP-005-S2",
      "requirements": [
        "REQ-EVID-001",
        "REQ-EVID-002"
      ],
      "contract_sha256": "4229663a2429a83e80e4777f90bcbe7466704e3951f28bd81f95ba5aee672b8d",